{
  "schema_version": "0.1",
  "profile_id": "USER-DEMO-001",
  "profile_type": "USER",
  "owner_label": "示例用户",
  "created_at": "2026-08-16T10:30:00+08:00",
  "updated_at": "2026-08-16T10:30:00+08:00",
  "last_migrated_from": "0.41",
  "last_migrated_to": "0.42",
  "default_upgrade_policy": "PRESERVE_USER",
  "settings": [
    {
      "setting_id": "PREF-001",
      "key": "writing.paragraph.single_sentence_policy",
      "scope": "USER",
      "matter_id": null,
      "category": "WRITING_STYLE",
      "value": "AVOID",
      "status": "ACTIVE",
      "source_type": "EXPLICIT_USER",
      "source_note": "用户明确要求正式文书不要一句话一段",
      "created_at": "2026-08-16T10:30:00+08:00",
      "updated_at": "2026-08-16T10:30:00+08:00",
      "applies_from_version": "0.42",
      "last_confirmed_version": "0.42",
      "registered": true,
      "notes": []
    },
    {
      "setting_id": "PREF-002",
      "key": "deliverable.default_format",
      "scope": "USER",
      "matter_id": null,
      "category": "DELIVERY",
      "value": "DOCX",
      "status": "ACTIVE",
      "source_type": "EXPLICIT_USER",
      "source_note": "示例：用户长期偏好正式文书优先 DOCX",
      "created_at": "2026-08-16T10:30:00+08:00",
      "updated_at": "2026-08-16T10:30:00+08:00",
      "applies_from_version": "0.42",
      "last_confirmed_version": "0.42",
      "registered": true,
      "notes": []
    }
  ],
  "custom_assets": [],
  "notes": [
    "示例文件，不代表系统替真实用户推断偏好。"
  ]
}
